{
  "schema": "com.saferide.local-ai-model-manifest",
  "schemaVersion": 1,
  "manifestId": "litert-community-gemma-4-e2b-litertlm-prototype-2026-06-29.1",
  "modelId": "litert-community/gemma-4-E2B-it-litert-lm",
  "humanLabel": "SafeRide local AI",
  "releaseChannel": "prototype",
  "status": "prototype",
  "runtime": {
    "kind": "litert-lm",
    "engine": "google-ai-edge-litert-lm",
    "androidModule": "saferide-litert-lm",
    "primaryFileRole": "model",
    "modelFileExtension": ".litertlm",
    "backendPlan": ["gpu", "cpu-text"],
    "cachePolicy": "app-cache",
    "acceleratorDefaults": {
      "textBackend": "gpu",
      "visionBackend": "disabled",
      "audioBackend": "disabled",
      "npuNativeLibraryDirRequired": false
    }
  },
  "lineage": {
    "baseModel": "google/gemma-4-E2B-it",
    "baseRevision": "unresolved-by-saferide",
    "baseTermsOwnerRole": "legal/compliance owner pending",
    "exportPipelineId": "litert-community-public-litertlm-2026-06-05",
    "exportCommit": "6e5c4f1e395deb959c494953478fa5cec4b8008f",
    "quantization": {
      "method": "Gemma 4 mobile quantization",
      "precision": "mixed-2bit-4bit-8bit",
      "tool": "LiteRT-LM public artifact handoff",
      "toolVersion": "unresolved-by-saferide"
    }
  },
  "artifacts": [
    {
      "role": "model",
      "fileName": "gemma-4-E2B-it.litertlm",
      "format": "litertlm",
      "immutableUrl": "https://huggingface.co/litert-community/gemma-4-E2B-it-litert-lm/resolve/361a4010ad6d88fc5c86e148e333c0342b99763d/gemma-4-E2B-it.litertlm?download=true",
      "controlledImportOnly": true,
      "immutableRevision": "361a4010ad6d88fc5c86e148e333c0342b99763d",
      "sha256": "181938105e0eefd105961417e8da75903eacda102c4fce9ce90f50b97139a63c",
      "sizeBytes": 2588147712,
      "required": true
    }
  ],
  "prompting": {
    "systemPromptId": "saferide-litert-runtime-smoke-v1",
    "systemPromptRevision": "docs/qa/saferide-ai-unicef-safe-assistant-policy-2026-06-28.md",
    "chatTemplateId": "litert-community/gemma-4-E2B-it-litert-lm:chat_template.jinja",
    "chatTemplateRevision": "d23202ebbc77c976719090aaa080362f29d746e2",
    "stopTokens": ["<turn|>"],
    "contextWindow": 2048,
    "maxInputTokens": 1536,
    "maxOutputTokens": 128
  },
  "samplerDefaults": {
    "temperature": 0.2,
    "topP": 0.9,
    "topK": 10
  },
  "capabilities": {
    "textGuidance": {
      "enabled": true,
      "stage": "prototype",
      "evidenceRef": "docs/qa/saferide-gemma4-e2b-physical-android-runtime-smoke-2026-07-13.md",
      "limitations": [
        "Base-model text behavior is restricted to explicitly configured local engineering runtime probes."
      ]
    },
    "incidentStructuring": {
      "enabled": false,
      "stage": "disabled",
      "limitations": ["No SafeRide no-new-facts evaluation exists for this reference artifact."]
    },
    "audioTranscription": {
      "enabled": false,
      "stage": "disabled",
      "evidenceRef": "docs/qa/saferide-gemma-4-e2b-audio-transcription-gate-2026-06-29.md",
      "limitations": [
        "Audio stays disabled until exact-artifact WER, entity-preservation, privacy, and physical Android evidence exist."
      ]
    },
    "imageUnderstanding": {
      "enabled": false,
      "stage": "disabled",
      "limitations": ["Image support is outside the approved SafeRide runtime path."]
    },
    "offenceTagging": {
      "enabled": false,
      "stage": "disabled",
      "evidenceRef": "docs/qa/saferide-gemma-4-e2b-offence-tagging-taxonomy-schema-2026-06-29.md",
      "limitations": ["Model-suggested offence tags lack conformance and reviewer evidence."]
    },
    "multilingual": {
      "enabled": false,
      "stage": "disabled",
      "limitations": ["No exact-artifact English and Kiswahili slice evaluation exists."]
    }
  },
  "deviceRequirements": {
    "androidMinSdk": 26,
    "supportedAbis": ["arm64-v8a"],
    "minRamGb": 8,
    "recommendedRamGb": 12,
    "storageRequiredBytes": 2588147712,
    "additionalFreeStorageBytes": 1073741824,
    "expectedFirstTokenMs": 1800,
    "expectedTokensPerSecond": 40,
    "thermalRisk": "unknown"
  },
  "safety": {
    "policyDoc": "docs/qa/saferide-ai-unicef-safe-assistant-policy-2026-06-28.md",
    "promptSuiteVersion": "docs/qa/safeRide-ai-safety-prompt-suite-2026-06-18.md",
    "rubricVersion": "docs/qa/safeRide-ai-safety-test-suite-rubric-2026-06-18.md",
    "criticalFailures": "unknown"
  },
  "privacy": {
    "privacyReviewDoc": "docs/qa/saferide-gemma-4-e2b-privacy-unicef-evidence-packet-2026-06-29.md",
    "rawPromptLogging": "forbidden",
    "rawCompletionLogging": "forbidden",
    "sensitiveDataUse": "none"
  },
  "license": {
    "accessDecisionDoc": "docs/security/saferide-ai-model-access-license-distribution-2026-06-28.md",
    "legalStatus": "pending",
    "publicSharing": "restricted"
  },
  "androidEvidence": {
    "deviceMatrixDoc": "docs/qa/saferide-gemma4-e2b-physical-android-runtime-smoke-2026-07-13.md",
    "physicalDeviceProof": true,
    "loadGenerateCancelUnload": true,
    "offlineProof": true
  },
  "limitations": [
    "This is the public base runtime, not a SafeRide-tuned model.",
    "The manifest is controlled-import only because legal, safety, privacy, and checkpoint approvals are incomplete.",
    "Physical proof covers one approximately 7.5 GB-memory Samsung device and does not establish 2 GB, 3 GB, or 4 GB support.",
    "No production, prerelease, UNICEF, survivor-facing, or tuned-mobile claim may use this manifest."
  ],
  "rollout": {
    "downloadMode": "controlled-import",
    "allowedBuildProfiles": ["development"],
    "userVisiblePreparationRequired": true,
    "maxRolloutPercent": 0
  },
  "rollback": {
    "rollbackTargetManifestId": "fail-closed:no-local-ai",
    "disableIfStatus": ["retired", "revoked"],
    "clearCachedReadyState": true,
    "blockNewDownloads": true,
    "removeLocalArtifactOnRevoke": true,
    "ownerRole": "mobile release owner"
  },
  "createdAt": "2026-06-29T00:00:00.000Z",
  "createdByRole": "mobile release owner"
}
